{
  "schemaVersion": 2,
  "id": "generative-models",
  "title": "生成模型：从噪声到图像",
  "status": "prototype",
  "curriculum": {
    "trackId": "ai-models",
    "moduleId": "generative-models"
  },
  "domain": "ai",
  "level": "intermediate",
  "summary": "一篇连贯的技术文章，借助关键原理图，从人为加噪的训练标签讲到 score 与反向生成，再自然引出 Flow Matching 的速度场和分布演化。",
  "prerequisites": [
    "理解神经网络训练与推理、基本概率分布和均方误差",
    "深入数学部分会用到条件期望、概率密度与常微分方程"
  ],
  "learningOutcomes": [
    "能够沿着同一条因果线解释训练监督如何得到、生成时如何使用已学预测",
    "理解高斯噪声条件平均与 score 的联系，以及为何不等于一次性还原原图",
    "区分 DDPM 的反向采样状态与干净样本估计",
    "解释 Flow Matching 为什么从训练配对学习平均速度场而生成时不需要配对终点",
    "把路径、网络预测目标与求解器看作不同设计维度"
  ],
  "knowledgeNodes": [
    {
      "id": "sampling-distribution",
      "title": "采样与数据分布",
      "dependsOn": []
    },
    {
      "id": "conditional-mean",
      "title": "平方误差与条件平均",
      "dependsOn": [
        "sampling-distribution"
      ]
    },
    {
      "id": "data-vector",
      "title": "数据、噪声与高维向量",
      "dependsOn": []
    },
    {
      "id": "probability-path",
      "title": "概率分布的连续路径",
      "dependsOn": [
        "sampling-distribution"
      ]
    },
    {
      "id": "diffusion-training",
      "title": "加噪与噪声预测训练",
      "dependsOn": [
        "conditional-mean",
        "data-vector"
      ]
    },
    {
      "id": "score",
      "title": "概率密度的 score 与去噪",
      "dependsOn": [
        "diffusion-training"
      ]
    },
    {
      "id": "diffusion-sampling",
      "title": "反向条件分布与逐步生成",
      "dependsOn": [
        "diffusion-training"
      ]
    },
    {
      "id": "flow-matching",
      "title": "条件速度回归与流匹配",
      "dependsOn": [
        "conditional-mean",
        "probability-path"
      ]
    },
    {
      "id": "numerical-sampling",
      "title": "ODE 采样与有限步误差",
      "dependsOn": [
        "flow-matching"
      ]
    },
    {
      "id": "generation-routes",
      "title": "自回归、VAE 与 GAN 的生成路线",
      "dependsOn": [
        "sampling-distribution"
      ]
    },
    {
      "id": "shared-probability-paths",
      "title": "分布路径、预测目标与采样器",
      "dependsOn": [
        "diffusion-sampling",
        "flow-matching"
      ]
    },
    {
      "id": "conditioning-and-latents",
      "title": "条件生成与潜空间",
      "dependsOn": [
        "generation-routes",
        "shared-probability-paths"
      ]
    }
  ],
  "chapters": [
    {
      "id": "from-noise-to-image",
      "title": "从一团噪声到一张图，生成模型究竟学会了什么？",
      "coreQuestion": "一个只用真实图片和人造标签训练的预测网络，为什么能让新随机数变成合理的数据样本？",
      "learningObjectives": [
        "能够沿着同一条因果线解释训练监督如何得到、生成时如何使用已学预测",
        "理解高斯噪声条件平均与 score 的联系，以及为何不等于一次性还原原图",
        "区分 DDPM 的反向采样状态与干净样本估计",
        "解释 Flow Matching 为什么从训练配对学习平均速度场而生成时不需要配对终点",
        "把路径、网络预测目标与求解器看作不同设计维度"
      ],
      "conceptIds": [
        "sampling-distribution",
        "conditional-mean",
        "data-vector",
        "probability-path",
        "diffusion-training",
        "score",
        "diffusion-sampling",
        "flow-matching",
        "numerical-sampling",
        "shared-probability-paths"
      ],
      "prerequisites": [
        "神经网络训练/推理、基本概率与梯度概念"
      ],
      "dependsOnChapterIds": [],
      "coreTask": "解释一条完整训练—生成链；比较噪声预测与速度预测，说明为何学习的局部规则可以驱动整个样本分布，而不是直接背公式。",
      "lessonPath": "src/content/lessons/generative-from-noise-to-image.mdx",
      "status": "prototype"
    }
  ],
  "plannedChapters": [],
  "design": {
    "learningBriefPath": "src/content/courses/generative-models/learning-brief.md",
    "knowledgeMapPath": "src/content/courses/generative-models/knowledge-map.md",
    "knowledgeLinksPath": "src/content/courses/generative-models/knowledge-map.json"
  }
}
